{
  "changelog": [
    {
      "change": "Initial pool index: every pooled puzzle of one Game, with its band.",
      "version": "2026-08-21T22:00",
      "why": "Row 22 - the Infinite Mode plays a pre-generated pool because there is no runtime generator (Holy Law #1), and a stream that fetched the whole pool to start would be the opposite of endless on a phone. The index is the smallest thing that can answer 'what may I play next': an id and a band per item, so the Mode can honour the player's difficulty filter and its own anti-repeat window without opening a single board it is not about to play."
    }
  ],
  "gameId": "wordle",
  "items": [
    {"difficulty": "easy", "id": "00000"},
    {"difficulty": "easy", "id": "00001"},
    {"difficulty": "easy", "id": "00002"},
    {"difficulty": "easy", "id": "00003"},
    {"difficulty": "easy", "id": "00004"},
    {"difficulty": "easy", "id": "00005"},
    {"difficulty": "easy", "id": "00006"},
    {"difficulty": "easy", "id": "00007"},
    {"difficulty": "easy", "id": "00008"},
    {"difficulty": "easy", "id": "00009"},
    {"difficulty": "easy", "id": "00010"},
    {"difficulty": "easy", "id": "00011"},
    {"difficulty": "easy", "id": "00012"},
    {"difficulty": "easy", "id": "00013"},
    {"difficulty": "easy", "id": "00014"},
    {"difficulty": "easy", "id": "00015"},
    {"difficulty": "easy", "id": "00016"},
    {"difficulty": "easy", "id": "00017"},
    {"difficulty": "easy", "id": "00018"},
    {"difficulty": "easy", "id": "00019"},
    {"difficulty": "easy", "id": "00020"},
    {"difficulty": "easy", "id": "00021"},
    {"difficulty": "easy", "id": "00022"},
    {"difficulty": "easy", "id": "00023"},
    {"difficulty": "easy", "id": "00024"},
    {"difficulty": "easy", "id": "00025"},
    {"difficulty": "easy", "id": "00026"},
    {"difficulty": "easy", "id": "00027"},
    {"difficulty": "easy", "id": "00028"},
    {"difficulty": "easy", "id": "00029"},
    {"difficulty": "easy", "id": "00030"},
    {"difficulty": "easy", "id": "00031"},
    {"difficulty": "easy", "id": "00032"},
    {"difficulty": "easy", "id": "00033"},
    {"difficulty": "easy", "id": "00034"},
    {"difficulty": "easy", "id": "00035"},
    {"difficulty": "easy", "id": "00036"},
    {"difficulty": "easy", "id": "00037"},
    {"difficulty": "easy", "id": "00038"},
    {"difficulty": "easy", "id": "00039"},
    {"difficulty": "easy", "id": "00040"},
    {"difficulty": "easy", "id": "00041"},
    {"difficulty": "easy", "id": "00042"},
    {"difficulty": "easy", "id": "00043"},
    {"difficulty": "easy", "id": "00044"},
    {"difficulty": "easy", "id": "00045"},
    {"difficulty": "easy", "id": "00046"},
    {"difficulty": "easy", "id": "00047"},
    {"difficulty": "easy", "id": "00048"},
    {"difficulty": "easy", "id": "00049"},
    {"difficulty": "easy", "id": "00050"},
    {"difficulty": "easy", "id": "00051"},
    {"difficulty": "easy", "id": "00052"},
    {"difficulty": "easy", "id": "00053"},
    {"difficulty": "easy", "id": "00054"},
    {"difficulty": "easy", "id": "00055"},
    {"difficulty": "easy", "id": "00056"},
    {"difficulty": "easy", "id": "00057"},
    {"difficulty": "easy", "id": "00058"},
    {"difficulty": "easy", "id": "00059"},
    {"difficulty": "easy", "id": "00060"},
    {"difficulty": "easy", "id": "00061"},
    {"difficulty": "easy", "id": "00062"},
    {"difficulty": "easy", "id": "00063"},
    {"difficulty": "easy", "id": "00064"},
    {"difficulty": "easy", "id": "00065"},
    {"difficulty": "easy", "id": "00066"},
    {"difficulty": "easy", "id": "00067"},
    {"difficulty": "easy", "id": "00068"},
    {"difficulty": "easy", "id": "00069"},
    {"difficulty": "easy", "id": "00070"},
    {"difficulty": "easy", "id": "00071"},
    {"difficulty": "easy", "id": "00072"},
    {"difficulty": "easy", "id": "00073"},
    {"difficulty": "easy", "id": "00074"},
    {"difficulty": "easy", "id": "00075"},
    {"difficulty": "easy", "id": "00076"},
    {"difficulty": "easy", "id": "00077"},
    {"difficulty": "easy", "id": "00078"},
    {"difficulty": "easy", "id": "00079"},
    {"difficulty": "easy", "id": "00080"},
    {"difficulty": "easy", "id": "00081"},
    {"difficulty": "easy", "id": "00082"},
    {"difficulty": "easy", "id": "00083"},
    {"difficulty": "easy", "id": "00084"},
    {"difficulty": "easy", "id": "00085"},
    {"difficulty": "easy", "id": "00086"},
    {"difficulty": "easy", "id": "00087"},
    {"difficulty": "easy", "id": "00088"},
    {"difficulty": "easy", "id": "00089"},
    {"difficulty": "easy", "id": "00090"},
    {"difficulty": "easy", "id": "00091"},
    {"difficulty": "easy", "id": "00092"},
    {"difficulty": "easy", "id": "00093"},
    {"difficulty": "easy", "id": "00094"},
    {"difficulty": "easy", "id": "00095"},
    {"difficulty": "easy", "id": "00096"},
    {"difficulty": "easy", "id": "00097"},
    {"difficulty": "easy", "id": "00098"},
    {"difficulty": "easy", "id": "00099"},
    {"difficulty": "medium", "id": "00100"},
    {"difficulty": "medium", "id": "00101"},
    {"difficulty": "medium", "id": "00102"},
    {"difficulty": "medium", "id": "00103"},
    {"difficulty": "medium", "id": "00104"},
    {"difficulty": "medium", "id": "00105"},
    {"difficulty": "medium", "id": "00106"},
    {"difficulty": "medium", "id": "00107"},
    {"difficulty": "medium", "id": "00108"},
    {"difficulty": "medium", "id": "00109"},
    {"difficulty": "medium", "id": "00110"},
    {"difficulty": "medium", "id": "00111"},
    {"difficulty": "medium", "id": "00112"},
    {"difficulty": "medium", "id": "00113"},
    {"difficulty": "medium", "id": "00114"},
    {"difficulty": "medium", "id": "00115"},
    {"difficulty": "medium", "id": "00116"},
    {"difficulty": "medium", "id": "00117"},
    {"difficulty": "medium", "id": "00118"},
    {"difficulty": "medium", "id": "00119"},
    {"difficulty": "medium", "id": "00120"},
    {"difficulty": "medium", "id": "00121"},
    {"difficulty": "medium", "id": "00122"},
    {"difficulty": "medium", "id": "00123"},
    {"difficulty": "medium", "id": "00124"},
    {"difficulty": "medium", "id": "00125"},
    {"difficulty": "medium", "id": "00126"},
    {"difficulty": "medium", "id": "00127"},
    {"difficulty": "medium", "id": "00128"},
    {"difficulty": "medium", "id": "00129"},
    {"difficulty": "medium", "id": "00130"},
    {"difficulty": "medium", "id": "00131"},
    {"difficulty": "medium", "id": "00132"},
    {"difficulty": "medium", "id": "00133"},
    {"difficulty": "medium", "id": "00134"},
    {"difficulty": "medium", "id": "00135"},
    {"difficulty": "medium", "id": "00136"},
    {"difficulty": "medium", "id": "00137"},
    {"difficulty": "medium", "id": "00138"},
    {"difficulty": "medium", "id": "00139"},
    {"difficulty": "medium", "id": "00140"},
    {"difficulty": "medium", "id": "00141"},
    {"difficulty": "medium", "id": "00142"},
    {"difficulty": "medium", "id": "00143"},
    {"difficulty": "medium", "id": "00144"},
    {"difficulty": "medium", "id": "00145"},
    {"difficulty": "medium", "id": "00146"},
    {"difficulty": "medium", "id": "00147"},
    {"difficulty": "medium", "id": "00148"},
    {"difficulty": "medium", "id": "00149"},
    {"difficulty": "medium", "id": "00150"},
    {"difficulty": "medium", "id": "00151"},
    {"difficulty": "medium", "id": "00152"},
    {"difficulty": "medium", "id": "00153"},
    {"difficulty": "medium", "id": "00154"},
    {"difficulty": "medium", "id": "00155"},
    {"difficulty": "medium", "id": "00156"},
    {"difficulty": "medium", "id": "00157"},
    {"difficulty": "medium", "id": "00158"},
    {"difficulty": "medium", "id": "00159"},
    {"difficulty": "medium", "id": "00160"},
    {"difficulty": "medium", "id": "00161"},
    {"difficulty": "medium", "id": "00162"},
    {"difficulty": "medium", "id": "00163"},
    {"difficulty": "medium", "id": "00164"},
    {"difficulty": "medium", "id": "00165"},
    {"difficulty": "medium", "id": "00166"},
    {"difficulty": "medium", "id": "00167"},
    {"difficulty": "medium", "id": "00168"},
    {"difficulty": "medium", "id": "00169"},
    {"difficulty": "medium", "id": "00170"},
    {"difficulty": "medium", "id": "00171"},
    {"difficulty": "medium", "id": "00172"},
    {"difficulty": "medium", "id": "00173"},
    {"difficulty": "medium", "id": "00174"},
    {"difficulty": "medium", "id": "00175"},
    {"difficulty": "medium", "id": "00176"},
    {"difficulty": "medium", "id": "00177"},
    {"difficulty": "medium", "id": "00178"},
    {"difficulty": "medium", "id": "00179"},
    {"difficulty": "medium", "id": "00180"},
    {"difficulty": "medium", "id": "00181"},
    {"difficulty": "medium", "id": "00182"},
    {"difficulty": "medium", "id": "00183"},
    {"difficulty": "medium", "id": "00184"},
    {"difficulty": "medium", "id": "00185"},
    {"difficulty": "medium", "id": "00186"},
    {"difficulty": "medium", "id": "00187"},
    {"difficulty": "medium", "id": "00188"},
    {"difficulty": "medium", "id": "00189"},
    {"difficulty": "medium", "id": "00190"},
    {"difficulty": "medium", "id": "00191"},
    {"difficulty": "medium", "id": "00192"},
    {"difficulty": "medium", "id": "00193"},
    {"difficulty": "medium", "id": "00194"},
    {"difficulty": "medium", "id": "00195"},
    {"difficulty": "medium", "id": "00196"},
    {"difficulty": "medium", "id": "00197"},
    {"difficulty": "medium", "id": "00198"},
    {"difficulty": "medium", "id": "00199"},
    {"difficulty": "hard", "id": "00200"},
    {"difficulty": "hard", "id": "00201"},
    {"difficulty": "hard", "id": "00202"},
    {"difficulty": "hard", "id": "00203"},
    {"difficulty": "hard", "id": "00204"},
    {"difficulty": "hard", "id": "00205"},
    {"difficulty": "hard", "id": "00206"},
    {"difficulty": "hard", "id": "00207"},
    {"difficulty": "hard", "id": "00208"},
    {"difficulty": "hard", "id": "00209"},
    {"difficulty": "hard", "id": "00210"},
    {"difficulty": "hard", "id": "00211"},